{"template_id":"minimal_pair","version":"1.0","required_slots":{"title":{"type":"string","max_chars":82},"left_title":{"type":"string","max_chars":46},"right_title":{"type":"string","max_chars":46},"left_items":{"type":"string[]","max_items":3,"max_chars":160},"right_items":{"type":"string[]","max_items":3,"max_chars":160},"pair_a":{"type":"string","max_chars":62},"pair_b":{"type":"string","max_chars":62},"trap":{"type":"string","max_chars":150}},"optional_slots":{}}
